{
  "version": 0,
  "event": {
    "seq": 7,
    "hash": "0x52030a580c0532eeae4a27f821c13a242b213d3732bf83663dd177130db3bd14"
  },
  "org_id": "0xa581bb78871a286f5e48b72433a4440c04303db610387e877d730ddb0366daab",
  "journal_id": "0x41c240366d993e0f2a4031f7177f26cb33a68f87652b51e0979dd863f21c5164",
  "generated_at": "2026-11-06T08:30:00.000Z",
  "parts": [
    {
      "name": "evenement",
      "file": "evenement.json",
      "sha256": "0x7849b34a2e1655c1522286af6b36fe1e402426ec6ad72b271c94119d88c91675",
      "present": true,
      "reason_if_absent": null
    },
    {
      "name": "voisins",
      "file": "voisins.json",
      "sha256": "0x1063e5ab45274be78b61c659ab092c11e51c6a78b10a5e773cd0a3965bb6259d",
      "present": true,
      "reason_if_absent": null
    },
    {
      "name": "chemin",
      "file": "chemin.json",
      "sha256": "0x7430538558f0313a6969788883228d207fe483ae39777d0f482dd8b3cc529d70",
      "present": true,
      "reason_if_absent": null
    },
    {
      "name": "manifeste",
      "file": "manifeste.json",
      "sha256": "0x2a92c91c8f3ca22c7dfc7f3a56e15fd6de6b61fbc109e18d034fb5dee7ff6662",
      "present": true,
      "reason_if_absent": null
    },
    {
      "name": "manifeste_sig",
      "file": "manifeste.sig",
      "sha256": "0xd6c842c6ac7e057f04c6bc1903cddac36c5856d7e2c4b934c7f56506b744c1ab",
      "present": true,
      "reason_if_absent": null
    },
    {
      "name": "cles",
      "file": "cles.json",
      "sha256": "0xbea7e6ca61f66d94eef9a8121d90ff635333770b7f74e608a78e2e28fc0976cc",
      "present": true,
      "reason_if_absent": null
    },
    {
      "name": "approbations",
      "file": "approbations.json",
      "sha256": "0xbc5bed6d2eb45e074a6b22c3f4b06a779d0cfd65d3c090a470d421fa0e434dd4",
      "present": true,
      "reason_if_absent": null
    },
    {
      "name": "jeton_rfc3161",
      "file": "jeton-rfc3161.der",
      "sha256": null,
      "present": false,
      "reason_if_absent": "hors périmètre CT-1"
    },
    {
      "name": "preuve_ots",
      "file": "preuve.ots",
      "sha256": null,
      "present": false,
      "reason_if_absent": "hors périmètre CT-1"
    },
    {
      "name": "registre",
      "file": "registre.json",
      "sha256": null,
      "present": false,
      "reason_if_absent": "hors périmètre CT-1"
    },
    {
      "name": "certificat_commit",
      "file": "certificat-commit.json",
      "sha256": null,
      "present": false,
      "reason_if_absent": "hors périmètre CT-1"
    },
    {
      "name": "validateurs",
      "file": "validateurs.json",
      "sha256": null,
      "present": false,
      "reason_if_absent": "hors périmètre CT-1"
    }
  ]
}
