{
  "version": 0,
  "event": {
    "seq": 7,
    "hash": "0xfec51c4d6cad5f6689ddee02c5ac6c674f9ad6bf2597334adad1d9fddcb8fc85"
  },
  "org_id": "0xa581bb78871a286f5e48b72433a4440c04303db610387e877d730ddb0366daab",
  "journal_id": "0x1c085ec2ae5b20dfef4c1b84694fb81a8c553e0a6e7a4fed3e5a6ada4bb9bd0e",
  "generated_at": "2026-11-10T11:05:00.000Z",
  "parts": [
    {
      "name": "evenement",
      "file": "evenement.json",
      "sha256": "0xb5097894716de455509cbc27f5234cbaadba7b9c52b3b3fb4056a80c5a96a9ac",
      "present": true,
      "reason_if_absent": null
    },
    {
      "name": "voisins",
      "file": "voisins.json",
      "sha256": "0x4e96f86b64439d783843d8f8cae54d047317ceb50f928765ebee966225963690",
      "present": true,
      "reason_if_absent": null
    },
    {
      "name": "chemin",
      "file": "chemin.json",
      "sha256": "0xa084ae5df4962027c4a6ab2331469f8fd6b1a6c69795fb8297d19b3ded353260",
      "present": true,
      "reason_if_absent": null
    },
    {
      "name": "manifeste",
      "file": "manifeste.json",
      "sha256": "0x374853d0ec558a8b340bf25292f29818364f5f514bf7798ec69095572d13f990",
      "present": true,
      "reason_if_absent": null
    },
    {
      "name": "manifeste_sig",
      "file": "manifeste.sig",
      "sha256": "0x9faa35e507be63d4009b5d437d98cb80bc504699e3fb324fb5a6d31ec2702279",
      "present": true,
      "reason_if_absent": null
    },
    {
      "name": "cles",
      "file": "cles.json",
      "sha256": "0x8b2cd54e82ad8179bf516af5e51b853788d11b018e787d007f834fc8fafade20",
      "present": true,
      "reason_if_absent": null
    },
    {
      "name": "approbations",
      "file": "approbations.json",
      "sha256": "0xc0db321236ccfa4c6b6e21ffb156f10be8c3deec1d7ce03949b31ce23fbd5c30",
      "present": true,
      "reason_if_absent": null
    },
    {
      "name": "jeton_rfc3161",
      "file": "jeton-rfc3161.der",
      "sha256": null,
      "present": false,
      "reason_if_absent": "hors périmètre CT-1"
    },
    {
      "name": "preuve_ots",
      "file": "preuve.ots",
      "sha256": null,
      "present": false,
      "reason_if_absent": "hors périmètre CT-1"
    },
    {
      "name": "registre",
      "file": "registre.json",
      "sha256": null,
      "present": false,
      "reason_if_absent": "hors périmètre CT-1"
    },
    {
      "name": "certificat_commit",
      "file": "certificat-commit.json",
      "sha256": null,
      "present": false,
      "reason_if_absent": "hors périmètre CT-1"
    },
    {
      "name": "validateurs",
      "file": "validateurs.json",
      "sha256": null,
      "present": false,
      "reason_if_absent": "hors périmètre CT-1"
    }
  ]
}
