{
  "version": 0,
  "event": {
    "seq": 7,
    "hash": "0x59aabeecabc61cc368451b7fbeb5a7d715408719f36ca3649bbd5f52d96f8a4a"
  },
  "org_id": "0xa581bb78871a286f5e48b72433a4440c04303db610387e877d730ddb0366daab",
  "journal_id": "0x41c240366d993e0f2a4031f7177f26cb33a68f87652b51e0979dd863f21c5164",
  "generated_at": "2026-11-06T08:30:00.000Z",
  "parts": [
    {
      "name": "evenement",
      "file": "evenement.json",
      "sha256": "0x190b3328417b6ac53044b48010352dcaf7e1c293b5569e84b068cc23ea24d838",
      "present": true,
      "reason_if_absent": null
    },
    {
      "name": "voisins",
      "file": "voisins.json",
      "sha256": "0x4b3dddace25549a7befaf3614bb62b7186d0f6a58c28cd8d3ccb7c898675d5ce",
      "present": true,
      "reason_if_absent": null
    },
    {
      "name": "chemin",
      "file": "chemin.json",
      "sha256": "0x1e5fb30316b9fadad6d17e59739de0e99bbf9b41393c59468232f683da634df6",
      "present": true,
      "reason_if_absent": null
    },
    {
      "name": "manifeste",
      "file": "manifeste.json",
      "sha256": "0x5417c44f11716b23422ad7c32727c608fd0dfca3ce479dfce1d96fe46d8c71fc",
      "present": true,
      "reason_if_absent": null
    },
    {
      "name": "manifeste_sig",
      "file": "manifeste.sig",
      "sha256": "0x3a5fe0e327ef82e7af1888a3cf66ebc1e38a9923bf3ab5d40eb329e5df05bd79",
      "present": true,
      "reason_if_absent": null
    },
    {
      "name": "cles",
      "file": "cles.json",
      "sha256": "0xbea7e6ca61f66d94eef9a8121d90ff635333770b7f74e608a78e2e28fc0976cc",
      "present": true,
      "reason_if_absent": null
    },
    {
      "name": "approbations",
      "file": "approbations.json",
      "sha256": "0xa9b7a13992c45c25d7091c3a44cd420200249ef6294582a9bcb6edf4086d9329",
      "present": true,
      "reason_if_absent": null
    },
    {
      "name": "jeton_rfc3161",
      "file": "jeton-rfc3161.der",
      "sha256": null,
      "present": false,
      "reason_if_absent": "hors périmètre CT-1"
    },
    {
      "name": "preuve_ots",
      "file": "preuve.ots",
      "sha256": null,
      "present": false,
      "reason_if_absent": "hors périmètre CT-1"
    },
    {
      "name": "registre",
      "file": "registre.json",
      "sha256": null,
      "present": false,
      "reason_if_absent": "hors périmètre CT-1"
    },
    {
      "name": "certificat_commit",
      "file": "certificat-commit.json",
      "sha256": null,
      "present": false,
      "reason_if_absent": "hors périmètre CT-1"
    },
    {
      "name": "validateurs",
      "file": "validateurs.json",
      "sha256": null,
      "present": false,
      "reason_if_absent": "hors périmètre CT-1"
    }
  ]
}
