{
  "version": 0,
  "event": {
    "seq": 13,
    "hash": "0xa322840897e8cb899ec6cd2993b1930059359b6ed77a591bf9f060aa3d0c8040"
  },
  "org_id": "0xa581bb78871a286f5e48b72433a4440c04303db610387e877d730ddb0366daab",
  "journal_id": "0x41c240366d993e0f2a4031f7177f26cb33a68f87652b51e0979dd863f21c5164",
  "generated_at": "2026-11-06T08:30:00.000Z",
  "parts": [
    {
      "name": "evenement",
      "file": "evenement.json",
      "sha256": "0x3cb1cfe15705b7a23b69b91ef99635efad002647c86aac0a3f9f36aba0144445",
      "present": true,
      "reason_if_absent": null
    },
    {
      "name": "voisins",
      "file": "voisins.json",
      "sha256": "0x82a5c23b92afdad434029cf1f6138ecfafbd2308c7da0a59cffa81b31b433ffb",
      "present": true,
      "reason_if_absent": null
    },
    {
      "name": "chemin",
      "file": "chemin.json",
      "sha256": "0x8bf3e82f7b6bad452ac86ec6de3e0288790c9fe1c24e46cec9334c347d10f630",
      "present": true,
      "reason_if_absent": null
    },
    {
      "name": "manifeste",
      "file": "manifeste.json",
      "sha256": "0xcb2eb5c3eb084e3cb4fb13b339ad0a8f88168e28f847862dd264e6f3a660dc7a",
      "present": true,
      "reason_if_absent": null
    },
    {
      "name": "manifeste_sig",
      "file": "manifeste.sig",
      "sha256": "0x60ff95ec721b17f5b61cc8dd751f8ad5825728f66d8d2fc67b192515b49f6fc0",
      "present": true,
      "reason_if_absent": null
    },
    {
      "name": "cles",
      "file": "cles.json",
      "sha256": "0xbea7e6ca61f66d94eef9a8121d90ff635333770b7f74e608a78e2e28fc0976cc",
      "present": true,
      "reason_if_absent": null
    },
    {
      "name": "approbations",
      "file": "approbations.json",
      "sha256": null,
      "present": false,
      "reason_if_absent": "aucune approbation liée"
    },
    {
      "name": "jeton_rfc3161",
      "file": "jeton-rfc3161.der",
      "sha256": null,
      "present": false,
      "reason_if_absent": "hors périmètre CT-1"
    },
    {
      "name": "preuve_ots",
      "file": "preuve.ots",
      "sha256": null,
      "present": false,
      "reason_if_absent": "hors périmètre CT-1"
    },
    {
      "name": "registre",
      "file": "registre.json",
      "sha256": null,
      "present": false,
      "reason_if_absent": "hors périmètre CT-1"
    },
    {
      "name": "certificat_commit",
      "file": "certificat-commit.json",
      "sha256": null,
      "present": false,
      "reason_if_absent": "hors périmètre CT-1"
    },
    {
      "name": "validateurs",
      "file": "validateurs.json",
      "sha256": null,
      "present": false,
      "reason_if_absent": "hors périmètre CT-1"
    },
    {
      "name": "points_de_controle",
      "file": "points-de-controle.json",
      "sha256": null,
      "present": false,
      "reason_if_absent": "aucun point de contrôle"
    },
    {
      "name": "attestation_perimetre",
      "file": "attestation-perimetre.json",
      "sha256": "0x4e3f9bd1cbf51471154dab29848742103c619518fb962fc93869c26304c8a120",
      "present": true,
      "reason_if_absent": null
    }
  ]
}
