{
  "version": 0,
  "event": {
    "seq": 7,
    "hash": "0x54803c3a767ca2b1419b3801e83084f7c1252bfbb4bed559eef4e4d210acf898"
  },
  "org_id": "0xa581bb78871a286f5e48b72433a4440c04303db610387e877d730ddb0366daab",
  "journal_id": "0x41c240366d993e0f2a4031f7177f26cb33a68f87652b51e0979dd863f21c5164",
  "generated_at": "2026-11-06T08:30:00.000Z",
  "parts": [
    {
      "name": "evenement",
      "file": "evenement.json",
      "sha256": "0x53d71a8852f86b818377e094a5c11494828355c9b6e81ba7c82adb800bea1bb9",
      "present": true,
      "reason_if_absent": null
    },
    {
      "name": "voisins",
      "file": "voisins.json",
      "sha256": "0x8b321c6323274af4db51043cce8c2027fb94a0b0f7ec7b38f251b6282b8d38cf",
      "present": true,
      "reason_if_absent": null
    },
    {
      "name": "chemin",
      "file": "chemin.json",
      "sha256": "0x6da22f1423198cda876e121677faac6e8da2d881f9fe246bd7c08b2ac9117017",
      "present": true,
      "reason_if_absent": null
    },
    {
      "name": "manifeste",
      "file": "manifeste.json",
      "sha256": "0xa52de328a59a17d1717b3e371c6f8d11279edfbeca0e0ffab4c979e06cfa6aca",
      "present": true,
      "reason_if_absent": null
    },
    {
      "name": "manifeste_sig",
      "file": "manifeste.sig",
      "sha256": "0x5cf78dff3e5503ad7a213527d67f3f3f9d768769b15771a5a271a6939e551812",
      "present": true,
      "reason_if_absent": null
    },
    {
      "name": "cles",
      "file": "cles.json",
      "sha256": "0xbea7e6ca61f66d94eef9a8121d90ff635333770b7f74e608a78e2e28fc0976cc",
      "present": true,
      "reason_if_absent": null
    },
    {
      "name": "approbations",
      "file": "approbations.json",
      "sha256": "0x298d235bcc99ab31eca3f9cc9c0ffe0b0b6385d44321bc5716d4dc351a5ac514",
      "present": true,
      "reason_if_absent": null
    },
    {
      "name": "jeton_rfc3161",
      "file": "jeton-rfc3161.der",
      "sha256": null,
      "present": false,
      "reason_if_absent": "hors périmètre CT-1"
    },
    {
      "name": "preuve_ots",
      "file": "preuve.ots",
      "sha256": null,
      "present": false,
      "reason_if_absent": "hors périmètre CT-1"
    },
    {
      "name": "registre",
      "file": "registre.json",
      "sha256": null,
      "present": false,
      "reason_if_absent": "hors périmètre CT-1"
    },
    {
      "name": "certificat_commit",
      "file": "certificat-commit.json",
      "sha256": null,
      "present": false,
      "reason_if_absent": "hors périmètre CT-1"
    },
    {
      "name": "validateurs",
      "file": "validateurs.json",
      "sha256": null,
      "present": false,
      "reason_if_absent": "hors périmètre CT-1"
    }
  ]
}
